No.     Time           Source                Destination           Protocol Length Info
      1 0.000000       192.168.130.129       34.149.100.209        TLSv1.2  100    Application Data

Frame 1: 100 bytes on wire (800 bits), 100 bytes captured (800 bits)
Ethernet II, Src: VMware_8e:c9:4a (00:0c:29:8e:c9:4a), Dst: VMware_f4:07:6a (00:50:56:f4:07:6a)
Internet Protocol Version 4, Src: 192.168.130.129, Dst: 34.149.100.209
Transmission Control Protocol, Src Port: 47328, Dst Port: 443, Seq: 1, Ack: 1, Len: 46
Transport Layer Security

No.     Time           Source                Destination           Protocol Length Info
      2 0.000933       34.149.100.209        192.168.130.129       TCP      60     443 → 47328 [ACK] Seq=1 Ack=47 Win=64240 Len=0

Frame 2: 60 bytes on wire (480 bits), 60 bytes captured (480 bits)
Ethernet II, Src: VMware_f4:07:6a (00:50:56:f4:07:6a), Dst: VMware_8e:c9:4a (00:0c:29:8e:c9:4a)
Internet Protocol Version 4, Src: 34.149.100.209, Dst: 192.168.130.129
Transmission Control Protocol, Src Port: 443, Dst Port: 47328, Seq: 1, Ack: 47, Len: 0

No.     Time           Source                Destination           Protocol Length Info
      3 0.011441       34.149.100.209        192.168.130.129       TLSv1.2  100    Application Data

Frame 3: 100 bytes on wire (800 bits), 100 bytes captured (800 bits)
Ethernet II, Src: VMware_f4:07:6a (00:50:56:f4:07:6a), Dst: VMware_8e:c9:4a (00:0c:29:8e:c9:4a)
Internet Protocol Version 4, Src: 34.149.100.209, Dst: 192.168.130.129
Transmission Control Protocol, Src Port: 443, Dst Port: 47328, Seq: 1, Ack: 47, Len: 46
Transport Layer Security

No.     Time           Source                Destination           Protocol Length Info
      4 0.011520       192.168.130.129       34.149.100.209        TCP      54     47328 → 443 [ACK] Seq=47 Ack=47 Win=65535 Len=0

Frame 4: 54 bytes on wire (432 bits), 54 bytes captured (432 bits)
Ethernet II, Src: VMware_8e:c9:4a (00:0c:29:8e:c9:4a), Dst: VMware_f4:07:6a (00:50:56:f4:07:6a)
Internet Protocol Version 4, Src: 192.168.130.129, Dst: 34.149.100.209
Transmission Control Protocol, Src Port: 47328, Dst Port: 443, Seq: 47, Ack: 47, Len: 0

No.     Time           Source                Destination           Protocol Length Info
      5 3.701779       192.168.130.1         224.0.0.251           MDNS     388    Standard query response 0x0000 PTR LAPTOP-70726CJ9._dosvc._tcp.local SRV 0 0 7680 LAPTOP-70726CJ9.local TXT

Frame 5: 388 bytes on wire (3104 bits), 388 bytes captured (3104 bits)
Ethernet II, Src: VMware_c0:00:08 (00:50:56:c0:00:08), Dst: IPv4mcast_fb (01:00:5e:00:00:fb)
Internet Protocol Version 4, Src: 192.168.130.1, Dst: 224.0.0.251
User Datagram Protocol, Src Port: 5353, Dst Port: 5353
Multicast Domain Name System (response)

No.     Time           Source                Destination           Protocol Length Info
      6 3.703673       fe80::e042:7b14:99aa:64a0 ff02::fb              MDNS     408    Standard query response 0x0000 PTR LAPTOP-70726CJ9._dosvc._tcp.local SRV 0 0 7680 LAPTOP-70726CJ9.local TXT

Frame 6: 408 bytes on wire (3264 bits), 408 bytes captured (3264 bits)
Ethernet II, Src: VMware_c0:00:08 (00:50:56:c0:00:08), Dst: IPv6mcast_fb (33:33:00:00:00:fb)
Internet Protocol Version 6, Src: fe80::e042:7b14:99aa:64a0, Dst: ff02::fb
User Datagram Protocol, Src Port: 5353, Dst Port: 5353
Multicast Domain Name System (response)

No.     Time           Source                Destination           Protocol Length Info
      7 3.705307       192.168.130.1         224.0.0.251           MDNS     93     Standard query 0x0000 ANY LAPTOP-70726CJ9._dosvc._tcp.local, "QM" question

Frame 7: 93 bytes on wire (744 bits), 93 bytes captured (744 bits)
Ethernet II, Src: VMware_c0:00:08 (00:50:56:c0:00:08), Dst: IPv4mcast_fb (01:00:5e:00:00:fb)
Internet Protocol Version 4, Src: 192.168.130.1, Dst: 224.0.0.251
User Datagram Protocol, Src Port: 5353, Dst Port: 5353
Multicast Domain Name System (query)

No.     Time           Source                Destination           Protocol Length Info
      8 3.707195       fe80::e042:7b14:99aa:64a0 ff02::fb              MDNS     113    Standard query 0x0000 ANY LAPTOP-70726CJ9._dosvc._tcp.local, "QM" question

Frame 8: 113 bytes on wire (904 bits), 113 bytes captured (904 bits)
Ethernet II, Src: VMware_c0:00:08 (00:50:56:c0:00:08), Dst: IPv6mcast_fb (33:33:00:00:00:fb)
Internet Protocol Version 6, Src: fe80::e042:7b14:99aa:64a0, Dst: ff02::fb
User Datagram Protocol, Src Port: 5353, Dst Port: 5353
Multicast Domain Name System (query)

No.     Time           Source                Destination           Protocol Length Info
      9 3.974975       192.168.130.1         224.0.0.251           MDNS     93     Standard query 0x0000 ANY LAPTOP-70726CJ9._dosvc._tcp.local, "QM" question

Frame 9: 93 bytes on wire (744 bits), 93 bytes captured (744 bits)
Ethernet II, Src: VMware_c0:00:08 (00:50:56:c0:00:08), Dst: IPv4mcast_fb (01:00:5e:00:00:fb)
Internet Protocol Version 4, Src: 192.168.130.1, Dst: 224.0.0.251
User Datagram Protocol, Src Port: 5353, Dst Port: 5353
Multicast Domain Name System (query)

No.     Time           Source                Destination           Protocol Length Info
     10 3.977024       fe80::e042:7b14:99aa:64a0 ff02::fb              MDNS     113    Standard query 0x0000 ANY LAPTOP-70726CJ9._dosvc._tcp.local, "QM" question

Frame 10: 113 bytes on wire (904 bits), 113 bytes captured (904 bits)
Ethernet II, Src: VMware_c0:00:08 (00:50:56:c0:00:08), Dst: IPv6mcast_fb (33:33:00:00:00:fb)
Internet Protocol Version 6, Src: fe80::e042:7b14:99aa:64a0, Dst: ff02::fb
User Datagram Protocol, Src Port: 5353, Dst Port: 5353
Multicast Domain Name System (query)

No.     Time           Source                Destination           Protocol Length Info
     11 4.245299       192.168.130.1         224.0.0.251           MDNS     93     Standard query 0x0000 ANY LAPTOP-70726CJ9._dosvc._tcp.local, "QM" question

Frame 11: 93 bytes on wire (744 bits), 93 bytes captured (744 bits)
Ethernet II, Src: VMware_c0:00:08 (00:50:56:c0:00:08), Dst: IPv4mcast_fb (01:00:5e:00:00:fb)
Internet Protocol Version 4, Src: 192.168.130.1, Dst: 224.0.0.251
User Datagram Protocol, Src Port: 5353, Dst Port: 5353
Multicast Domain Name System (query)

No.     Time           Source                Destination           Protocol Length Info
     12 4.247204       fe80::e042:7b14:99aa:64a0 ff02::fb              MDNS     113    Standard query 0x0000 ANY LAPTOP-70726CJ9._dosvc._tcp.local, "QM" question

Frame 12: 113 bytes on wire (904 bits), 113 bytes captured (904 bits)
Ethernet II, Src: VMware_c0:00:08 (00:50:56:c0:00:08), Dst: IPv6mcast_fb (33:33:00:00:00:fb)
Internet Protocol Version 6, Src: fe80::e042:7b14:99aa:64a0, Dst: ff02::fb
User Datagram Protocol, Src Port: 5353, Dst Port: 5353
Multicast Domain Name System (query)

No.     Time           Source                Destination           Protocol Length Info
     13 4.503359       192.168.130.1         224.0.0.251           MDNS     453    Standard query response 0x0000 PTR, cache flush LAPTOP-70726CJ9._dosvc._tcp.local SRV, cache flush 0 0 7680 LAPTOP-70726CJ9.local TXT, cache flush A, cache flush 192.168.130.1 AAAA, cache flush fe80::e042:7b14:99aa:64a0

Frame 13: 453 bytes on wire (3624 bits), 453 bytes captured (3624 bits)
Ethernet II, Src: VMware_c0:00:08 (00:50:56:c0:00:08), Dst: IPv4mcast_fb (01:00:5e:00:00:fb)
Internet Protocol Version 4, Src: 192.168.130.1, Dst: 224.0.0.251
User Datagram Protocol, Src Port: 5353, Dst Port: 5353
Multicast Domain Name System (response)

No.     Time           Source                Destination           Protocol Length Info
     14 4.506181       fe80::e042:7b14:99aa:64a0 ff02::fb              MDNS     473    Standard query response 0x0000 PTR, cache flush LAPTOP-70726CJ9._dosvc._tcp.local SRV, cache flush 0 0 7680 LAPTOP-70726CJ9.local TXT, cache flush A, cache flush 192.168.130.1 AAAA, cache flush fe80::e042:7b14:99aa:64a0

Frame 14: 473 bytes on wire (3784 bits), 473 bytes captured (3784 bits)
Ethernet II, Src: VMware_c0:00:08 (00:50:56:c0:00:08), Dst: IPv6mcast_fb (33:33:00:00:00:fb)
Internet Protocol Version 6, Src: fe80::e042:7b14:99aa:64a0, Dst: ff02::fb
User Datagram Protocol, Src Port: 5353, Dst Port: 5353
Multicast Domain Name System (response)

No.     Time           Source                Destination           Protocol Length Info
     15 4.508523       192.168.130.1         224.0.0.251           MDNS     389    Standard query response 0x0000 SRV, cache flush 0 0 7680 LAPTOP-70726CJ9.local TXT, cache flush A, cache flush 192.168.130.1 AAAA, cache flush fe80::e042:7b14:99aa:64a0

Frame 15: 389 bytes on wire (3112 bits), 389 bytes captured (3112 bits)
Ethernet II, Src: VMware_c0:00:08 (00:50:56:c0:00:08), Dst: IPv4mcast_fb (01:00:5e:00:00:fb)
Internet Protocol Version 4, Src: 192.168.130.1, Dst: 224.0.0.251
User Datagram Protocol, Src Port: 5353, Dst Port: 5353
Multicast Domain Name System (response)

No.     Time           Source                Destination           Protocol Length Info
     16 4.510982       fe80::e042:7b14:99aa:64a0 ff02::fb              MDNS     409    Standard query response 0x0000 SRV, cache flush 0 0 7680 LAPTOP-70726CJ9.local TXT, cache flush A, cache flush 192.168.130.1 AAAA, cache flush fe80::e042:7b14:99aa:64a0

Frame 16: 409 bytes on wire (3272 bits), 409 bytes captured (3272 bits)
Ethernet II, Src: VMware_c0:00:08 (00:50:56:c0:00:08), Dst: IPv6mcast_fb (33:33:00:00:00:fb)
Internet Protocol Version 6, Src: fe80::e042:7b14:99aa:64a0, Dst: ff02::fb
User Datagram Protocol, Src Port: 5353, Dst Port: 5353
Multicast Domain Name System (response)

No.     Time           Source                Destination           Protocol Length Info
     17 29.003043      192.168.130.129       35.244.181.201        TLSv1.2  100    Application Data

Frame 17: 100 bytes on wire (800 bits), 100 bytes captured (800 bits)
Ethernet II, Src: VMware_8e:c9:4a (00:0c:29:8e:c9:4a), Dst: VMware_f4:07:6a (00:50:56:f4:07:6a)
Internet Protocol Version 4, Src: 192.168.130.129, Dst: 35.244.181.201
Transmission Control Protocol, Src Port: 60546, Dst Port: 443, Seq: 1, Ack: 1, Len: 46
Transport Layer Security

No.     Time           Source                Destination           Protocol Length Info
     18 29.003244      192.168.130.129       34.160.144.191        TLSv1.2  100    Application Data

Frame 18: 100 bytes on wire (800 bits), 100 bytes captured (800 bits)
Ethernet II, Src: VMware_8e:c9:4a (00:0c:29:8e:c9:4a), Dst: VMware_f4:07:6a (00:50:56:f4:07:6a)
Internet Protocol Version 4, Src: 192.168.130.129, Dst: 34.160.144.191
Transmission Control Protocol, Src Port: 45730, Dst Port: 443, Seq: 1, Ack: 1, Len: 46
Transport Layer Security

No.     Time           Source                Destination           Protocol Length Info
     19 29.004125      35.244.181.201        192.168.130.129       TCP      60     443 → 60546 [ACK] Seq=1 Ack=47 Win=64240 Len=0

Frame 19: 60 bytes on wire (480 bits), 60 bytes captured (480 bits)
Ethernet II, Src: VMware_f4:07:6a (00:50:56:f4:07:6a), Dst: VMware_8e:c9:4a (00:0c:29:8e:c9:4a)
Internet Protocol Version 4, Src: 35.244.181.201, Dst: 192.168.130.129
Transmission Control Protocol, Src Port: 443, Dst Port: 60546, Seq: 1, Ack: 47, Len: 0

No.     Time           Source                Destination           Protocol Length Info
     20 29.005009      34.160.144.191        192.168.130.129       TCP      60     443 → 45730 [ACK] Seq=1 Ack=47 Win=64240 Len=0

Frame 20: 60 bytes on wire (480 bits), 60 bytes captured (480 bits)
Ethernet II, Src: VMware_f4:07:6a (00:50:56:f4:07:6a), Dst: VMware_8e:c9:4a (00:0c:29:8e:c9:4a)
Internet Protocol Version 4, Src: 34.160.144.191, Dst: 192.168.130.129
Transmission Control Protocol, Src Port: 443, Dst Port: 45730, Seq: 1, Ack: 47, Len: 0

No.     Time           Source                Destination           Protocol Length Info
     21 29.024280      35.244.181.201        192.168.130.129       TLSv1.2  100    Application Data

Frame 21: 100 bytes on wire (800 bits), 100 bytes captured (800 bits)
Ethernet II, Src: VMware_f4:07:6a (00:50:56:f4:07:6a), Dst: VMware_8e:c9:4a (00:0c:29:8e:c9:4a)
Internet Protocol Version 4, Src: 35.244.181.201, Dst: 192.168.130.129
Transmission Control Protocol, Src Port: 443, Dst Port: 60546, Seq: 1, Ack: 47, Len: 46
Transport Layer Security

No.     Time           Source                Destination           Protocol Length Info
     22 29.024280      34.160.144.191        192.168.130.129       TLSv1.2  100    Application Data

Frame 22: 100 bytes on wire (800 bits), 100 bytes captured (800 bits)
Ethernet II, Src: VMware_f4:07:6a (00:50:56:f4:07:6a), Dst: VMware_8e:c9:4a (00:0c:29:8e:c9:4a)
Internet Protocol Version 4, Src: 34.160.144.191, Dst: 192.168.130.129
Transmission Control Protocol, Src Port: 443, Dst Port: 45730, Seq: 1, Ack: 47, Len: 46
Transport Layer Security

No.     Time           Source                Destination           Protocol Length Info
     23 29.024385      192.168.130.129       35.244.181.201        TCP      54     60546 → 443 [ACK] Seq=47 Ack=47 Win=64438 Len=0

Frame 23: 54 bytes on wire (432 bits), 54 bytes captured (432 bits)
Ethernet II, Src: VMware_8e:c9:4a (00:0c:29:8e:c9:4a), Dst: VMware_f4:07:6a (00:50:56:f4:07:6a)
Internet Protocol Version 4, Src: 192.168.130.129, Dst: 35.244.181.201
Transmission Control Protocol, Src Port: 60546, Dst Port: 443, Seq: 47, Ack: 47, Len: 0

No.     Time           Source                Destination           Protocol Length Info
     24 29.024478      192.168.130.129       34.160.144.191        TCP      54     45730 → 443 [ACK] Seq=47 Ack=47 Win=64015 Len=0

Frame 24: 54 bytes on wire (432 bits), 54 bytes captured (432 bits)
Ethernet II, Src: VMware_8e:c9:4a (00:0c:29:8e:c9:4a), Dst: VMware_f4:07:6a (00:50:56:f4:07:6a)
Internet Protocol Version 4, Src: 192.168.130.129, Dst: 34.160.144.191
Transmission Control Protocol, Src Port: 45730, Dst Port: 443, Seq: 47, Ack: 47, Len: 0

No.     Time           Source                Destination           Protocol Length Info
     25 34.198646      VMware_8e:c9:4a       VMware_f4:07:6a       ARP      42     Who has 192.168.130.2? Tell 192.168.130.129

Frame 25: 42 bytes on wire (336 bits), 42 bytes captured (336 bits)
Ethernet II, Src: VMware_8e:c9:4a (00:0c:29:8e:c9:4a), Dst: VMware_f4:07:6a (00:50:56:f4:07:6a)
Address Resolution Protocol (request)

No.     Time           Source                Destination           Protocol Length Info
     26 34.198945      VMware_f4:07:6a       VMware_8e:c9:4a       ARP      60     192.168.130.2 is at 00:50:56:f4:07:6a

Frame 26: 60 bytes on wire (480 bits), 60 bytes captured (480 bits)
Ethernet II, Src: VMware_f4:07:6a (00:50:56:f4:07:6a), Dst: VMware_8e:c9:4a (00:0c:29:8e:c9:4a)
Address Resolution Protocol (reply)

No.     Time           Source                Destination           Protocol Length Info
     27 43.086986      192.168.130.129       34.36.137.203         TLSv1.2  93     Application Data

Frame 27: 93 bytes on wire (744 bits), 93 bytes captured (744 bits)
Ethernet II, Src: VMware_8e:c9:4a (00:0c:29:8e:c9:4a), Dst: VMware_f4:07:6a (00:50:56:f4:07:6a)
Internet Protocol Version 4, Src: 192.168.130.129, Dst: 34.36.137.203
Transmission Control Protocol, Src Port: 49344, Dst Port: 443, Seq: 1, Ack: 1, Len: 39
Transport Layer Security

No.     Time           Source                Destination           Protocol Length Info
     28 43.087404      192.168.130.129       34.36.137.203         TLSv1.2  78     Application Data

Frame 28: 78 bytes on wire (624 bits), 78 bytes captured (624 bits)
Ethernet II, Src: VMware_8e:c9:4a (00:0c:29:8e:c9:4a), Dst: VMware_f4:07:6a (00:50:56:f4:07:6a)
Internet Protocol Version 4, Src: 192.168.130.129, Dst: 34.36.137.203
Transmission Control Protocol, Src Port: 49344, Dst Port: 443, Seq: 40, Ack: 1, Len: 24
Transport Layer Security

No.     Time           Source                Destination           Protocol Length Info
     29 43.087491      192.168.130.129       34.36.137.203         TCP      54     49344 → 443 [FIN, ACK] Seq=64 Ack=1 Win=63301 Len=0

Frame 29: 54 bytes on wire (432 bits), 54 bytes captured (432 bits)
Ethernet II, Src: VMware_8e:c9:4a (00:0c:29:8e:c9:4a), Dst: VMware_f4:07:6a (00:50:56:f4:07:6a)
Internet Protocol Version 4, Src: 192.168.130.129, Dst: 34.36.137.203
Transmission Control Protocol, Src Port: 49344, Dst Port: 443, Seq: 64, Ack: 1, Len: 0

No.     Time           Source                Destination           Protocol Length Info
     30 43.087653      34.36.137.203         192.168.130.129       TCP      60     443 → 49344 [ACK] Seq=1 Ack=40 Win=64240 Len=0

Frame 30: 60 bytes on wire (480 bits), 60 bytes captured (480 bits)
Ethernet II, Src: VMware_f4:07:6a (00:50:56:f4:07:6a), Dst: VMware_8e:c9:4a (00:0c:29:8e:c9:4a)
Internet Protocol Version 4, Src: 34.36.137.203, Dst: 192.168.130.129
Transmission Control Protocol, Src Port: 443, Dst Port: 49344, Seq: 1, Ack: 40, Len: 0

No.     Time           Source                Destination           Protocol Length Info
     31 43.087653      34.36.137.203         192.168.130.129       TCP      60     443 → 49344 [ACK] Seq=1 Ack=64 Win=64240 Len=0

Frame 31: 60 bytes on wire (480 bits), 60 bytes captured (480 bits)
Ethernet II, Src: VMware_f4:07:6a (00:50:56:f4:07:6a), Dst: VMware_8e:c9:4a (00:0c:29:8e:c9:4a)
Internet Protocol Version 4, Src: 34.36.137.203, Dst: 192.168.130.129
Transmission Control Protocol, Src Port: 443, Dst Port: 49344, Seq: 1, Ack: 64, Len: 0

No.     Time           Source                Destination           Protocol Length Info
     32 43.088420      34.36.137.203         192.168.130.129       TCP      60     443 → 49344 [ACK] Seq=1 Ack=65 Win=64239 Len=0

Frame 32: 60 bytes on wire (480 bits), 60 bytes captured (480 bits)
Ethernet II, Src: VMware_f4:07:6a (00:50:56:f4:07:6a), Dst: VMware_8e:c9:4a (00:0c:29:8e:c9:4a)
Internet Protocol Version 4, Src: 34.36.137.203, Dst: 192.168.130.129
Transmission Control Protocol, Src Port: 443, Dst Port: 49344, Seq: 1, Ack: 65, Len: 0

No.     Time           Source                Destination           Protocol Length Info
     33 43.100437      34.36.137.203         192.168.130.129       TCP      60     443 → 49344 [FIN, PSH, ACK] Seq=1 Ack=65 Win=64239 Len=0

Frame 33: 60 bytes on wire (480 bits), 60 bytes captured (480 bits)
Ethernet II, Src: VMware_f4:07:6a (00:50:56:f4:07:6a), Dst: VMware_8e:c9:4a (00:0c:29:8e:c9:4a)
Internet Protocol Version 4, Src: 34.36.137.203, Dst: 192.168.130.129
Transmission Control Protocol, Src Port: 443, Dst Port: 49344, Seq: 1, Ack: 65, Len: 0

No.     Time           Source                Destination           Protocol Length Info
     34 43.100472      192.168.130.129       34.36.137.203         TCP      54     49344 → 443 [ACK] Seq=65 Ack=2 Win=63301 Len=0

Frame 34: 54 bytes on wire (432 bits), 54 bytes captured (432 bits)
Ethernet II, Src: VMware_8e:c9:4a (00:0c:29:8e:c9:4a), Dst: VMware_f4:07:6a (00:50:56:f4:07:6a)
Internet Protocol Version 4, Src: 192.168.130.129, Dst: 34.36.137.203
Transmission Control Protocol, Src Port: 49344, Dst Port: 443, Seq: 65, Ack: 2, Len: 0

No.     Time           Source                Destination           Protocol Length Info
     35 54.023362      192.168.130.129       34.149.100.209        TLSv1.2  100    Application Data

Frame 35: 100 bytes on wire (800 bits), 100 bytes captured (800 bits)
Ethernet II, Src: VMware_8e:c9:4a (00:0c:29:8e:c9:4a), Dst: VMware_f4:07:6a (00:50:56:f4:07:6a)
Internet Protocol Version 4, Src: 192.168.130.129, Dst: 34.149.100.209
Transmission Control Protocol, Src Port: 47328, Dst Port: 443, Seq: 47, Ack: 47, Len: 46
Transport Layer Security

No.     Time           Source                Destination           Protocol Length Info
     36 54.024117      192.168.130.129       34.149.100.209        TLSv1.2  85     Encrypted Alert

Frame 36: 85 bytes on wire (680 bits), 85 bytes captured (680 bits)
Ethernet II, Src: VMware_8e:c9:4a (00:0c:29:8e:c9:4a), Dst: VMware_f4:07:6a (00:50:56:f4:07:6a)
Internet Protocol Version 4, Src: 192.168.130.129, Dst: 34.149.100.209
Transmission Control Protocol, Src Port: 47328, Dst Port: 443, Seq: 93, Ack: 47, Len: 31
Transport Layer Security

No.     Time           Source                Destination           Protocol Length Info
     37 54.024354      192.168.130.129       34.149.100.209        TCP      54     47328 → 443 [FIN, ACK] Seq=124 Ack=47 Win=65535 Len=0

Frame 37: 54 bytes on wire (432 bits), 54 bytes captured (432 bits)
Ethernet II, Src: VMware_8e:c9:4a (00:0c:29:8e:c9:4a), Dst: VMware_f4:07:6a (00:50:56:f4:07:6a)
Internet Protocol Version 4, Src: 192.168.130.129, Dst: 34.149.100.209
Transmission Control Protocol, Src Port: 47328, Dst Port: 443, Seq: 124, Ack: 47, Len: 0

No.     Time           Source                Destination           Protocol Length Info
     38 54.024929      34.149.100.209        192.168.130.129       TCP      60     443 → 47328 [ACK] Seq=47 Ack=93 Win=64240 Len=0

Frame 38: 60 bytes on wire (480 bits), 60 bytes captured (480 bits)
Ethernet II, Src: VMware_f4:07:6a (00:50:56:f4:07:6a), Dst: VMware_8e:c9:4a (00:0c:29:8e:c9:4a)
Internet Protocol Version 4, Src: 34.149.100.209, Dst: 192.168.130.129
Transmission Control Protocol, Src Port: 443, Dst Port: 47328, Seq: 47, Ack: 93, Len: 0

No.     Time           Source                Destination           Protocol Length Info
     39 54.024930      34.149.100.209        192.168.130.129       TCP      60     443 → 47328 [ACK] Seq=47 Ack=124 Win=64240 Len=0

Frame 39: 60 bytes on wire (480 bits), 60 bytes captured (480 bits)
Ethernet II, Src: VMware_f4:07:6a (00:50:56:f4:07:6a), Dst: VMware_8e:c9:4a (00:0c:29:8e:c9:4a)
Internet Protocol Version 4, Src: 34.149.100.209, Dst: 192.168.130.129
Transmission Control Protocol, Src Port: 443, Dst Port: 47328, Seq: 47, Ack: 124, Len: 0

No.     Time           Source                Destination           Protocol Length Info
     40 54.025311      34.149.100.209        192.168.130.129       TCP      60     443 → 47328 [ACK] Seq=47 Ack=125 Win=64239 Len=0

Frame 40: 60 bytes on wire (480 bits), 60 bytes captured (480 bits)
Ethernet II, Src: VMware_f4:07:6a (00:50:56:f4:07:6a), Dst: VMware_8e:c9:4a (00:0c:29:8e:c9:4a)
Internet Protocol Version 4, Src: 34.149.100.209, Dst: 192.168.130.129
Transmission Control Protocol, Src Port: 443, Dst Port: 47328, Seq: 47, Ack: 125, Len: 0

No.     Time           Source                Destination           Protocol Length Info
     41 54.035684      34.149.100.209        192.168.130.129       TCP      60     443 → 47328 [FIN, PSH, ACK] Seq=47 Ack=125 Win=64239 Len=0

Frame 41: 60 bytes on wire (480 bits), 60 bytes captured (480 bits)
Ethernet II, Src: VMware_f4:07:6a (00:50:56:f4:07:6a), Dst: VMware_8e:c9:4a (00:0c:29:8e:c9:4a)
Internet Protocol Version 4, Src: 34.149.100.209, Dst: 192.168.130.129
Transmission Control Protocol, Src Port: 443, Dst Port: 47328, Seq: 47, Ack: 125, Len: 0

No.     Time           Source                Destination           Protocol Length Info
     42 54.035718      192.168.130.129       34.149.100.209        TCP      54     47328 → 443 [ACK] Seq=125 Ack=48 Win=19144 Len=0

Frame 42: 54 bytes on wire (432 bits), 54 bytes captured (432 bits)
Ethernet II, Src: VMware_8e:c9:4a (00:0c:29:8e:c9:4a), Dst: VMware_f4:07:6a (00:50:56:f4:07:6a)
Internet Protocol Version 4, Src: 192.168.130.129, Dst: 34.149.100.209
Transmission Control Protocol, Src Port: 47328, Dst Port: 443, Seq: 125, Ack: 48, Len: 0

No.     Time           Source                Destination           Protocol Length Info
     43 70.928986      192.168.130.129       192.168.130.2         DNS      74     Standard query 0x7e6a A www.google.com

Frame 43: 74 bytes on wire (592 bits), 74 bytes captured (592 bits)
Ethernet II, Src: VMware_8e:c9:4a (00:0c:29:8e:c9:4a), Dst: VMware_f4:07:6a (00:50:56:f4:07:6a)
Internet Protocol Version 4, Src: 192.168.130.129, Dst: 192.168.130.2
User Datagram Protocol, Src Port: 58972, Dst Port: 53
Domain Name System (query)

No.     Time           Source                Destination           Protocol Length Info
     44 70.940230      192.168.130.2         192.168.130.129       DNS      138    Standard query response 0x7e6a A www.google.com A 142.250.77.196 A 172.217.26.36 A 172.217.24.68 A 142.250.76.68

Frame 44: 138 bytes on wire (1104 bits), 138 bytes captured (1104 bits)
Ethernet II, Src: VMware_f4:07:6a (00:50:56:f4:07:6a), Dst: VMware_8e:c9:4a (00:0c:29:8e:c9:4a)
Internet Protocol Version 4, Src: 192.168.130.2, Dst: 192.168.130.129
User Datagram Protocol, Src Port: 53, Dst Port: 58972
Domain Name System (response)

No.     Time           Source                Destination           Protocol Length Info
     45 70.940347      192.168.130.129       192.168.130.2         DNS      74     Standard query 0xab64 AAAA www.google.com

Frame 45: 74 bytes on wire (592 bits), 74 bytes captured (592 bits)
Ethernet II, Src: VMware_8e:c9:4a (00:0c:29:8e:c9:4a), Dst: VMware_f4:07:6a (00:50:56:f4:07:6a)
Internet Protocol Version 4, Src: 192.168.130.129, Dst: 192.168.130.2
User Datagram Protocol, Src Port: 58972, Dst Port: 53
Domain Name System (query)

No.     Time           Source                Destination           Protocol Length Info
     46 70.948224      192.168.130.2         192.168.130.129       DNS      510    Standard query response 0xab64 AAAA www.google.com AAAA 2404:6800:4002:80a::2004 OPT

Frame 46: 510 bytes on wire (4080 bits), 510 bytes captured (4080 bits)
Ethernet II, Src: VMware_f4:07:6a (00:50:56:f4:07:6a), Dst: VMware_8e:c9:4a (00:0c:29:8e:c9:4a)
Internet Protocol Version 4, Src: 192.168.130.2, Dst: 192.168.130.129
User Datagram Protocol, Src Port: 53, Dst Port: 58972
Domain Name System (response)

No.     Time           Source                Destination           Protocol Length Info
     47 70.949313      192.168.130.129       142.250.77.196        TCP      74     57896 → 443 [SYN] Seq=0 Win=64240 Len=0 MSS=1460 SACK_PERM TSval=2483876387 TSecr=0 WS=128

Frame 47: 74 bytes on wire (592 bits), 74 bytes captured (592 bits)
Ethernet II, Src: VMware_8e:c9:4a (00:0c:29:8e:c9:4a), Dst: VMware_f4:07:6a (00:50:56:f4:07:6a)
Internet Protocol Version 4, Src: 192.168.130.129, Dst: 142.250.77.196
Transmission Control Protocol, Src Port: 57896, Dst Port: 443, Seq: 0, Len: 0

No.     Time           Source                Destination           Protocol Length Info
     48 70.961033      142.250.77.196        192.168.130.129       TCP      60     443 → 57896 [SYN, ACK] Seq=0 Ack=1 Win=64240 Len=0 MSS=1460

Frame 48: 60 bytes on wire (480 bits), 60 bytes captured (480 bits)
Ethernet II, Src: VMware_f4:07:6a (00:50:56:f4:07:6a), Dst: VMware_8e:c9:4a (00:0c:29:8e:c9:4a)
Internet Protocol Version 4, Src: 142.250.77.196, Dst: 192.168.130.129
Transmission Control Protocol, Src Port: 443, Dst Port: 57896, Seq: 0, Ack: 1, Len: 0

No.     Time           Source                Destination           Protocol Length Info
     49 70.961089      192.168.130.129       142.250.77.196        TCP      54     57896 → 443 [ACK] Seq=1 Ack=1 Win=64240 Len=0

Frame 49: 54 bytes on wire (432 bits), 54 bytes captured (432 bits)
Ethernet II, Src: VMware_8e:c9:4a (00:0c:29:8e:c9:4a), Dst: VMware_f4:07:6a (00:50:56:f4:07:6a)
Internet Protocol Version 4, Src: 192.168.130.129, Dst: 142.250.77.196
Transmission Control Protocol, Src Port: 57896, Dst Port: 443, Seq: 1, Ack: 1, Len: 0

No.     Time           Source                Destination           Protocol Length Info
     50 70.965695      192.168.130.129       142.250.77.196        TLSv1.3  716    Client Hello (SNI=www.google.com)

Frame 50: 716 bytes on wire (5728 bits), 716 bytes captured (5728 bits)
Ethernet II, Src: VMware_8e:c9:4a (00:0c:29:8e:c9:4a), Dst: VMware_f4:07:6a (00:50:56:f4:07:6a)
Internet Protocol Version 4, Src: 192.168.130.129, Dst: 142.250.77.196
Transmission Control Protocol, Src Port: 57896, Dst Port: 443, Seq: 1, Ack: 1, Len: 662
Transport Layer Security

No.     Time           Source                Destination           Protocol Length Info
     51 70.966363      142.250.77.196        192.168.130.129       TCP      60     443 → 57896 [ACK] Seq=1 Ack=663 Win=64240 Len=0

Frame 51: 60 bytes on wire (480 bits), 60 bytes captured (480 bits)
Ethernet II, Src: VMware_f4:07:6a (00:50:56:f4:07:6a), Dst: VMware_8e:c9:4a (00:0c:29:8e:c9:4a)
Internet Protocol Version 4, Src: 142.250.77.196, Dst: 192.168.130.129
Transmission Control Protocol, Src Port: 443, Dst Port: 57896, Seq: 1, Ack: 663, Len: 0

No.     Time           Source                Destination           Protocol Length Info
     52 70.980785      142.250.77.196        192.168.130.129       TLSv1.3  1466   Server Hello, Change Cipher Spec

Frame 52: 1466 bytes on wire (11728 bits), 1466 bytes captured (11728 bits)
Ethernet II, Src: VMware_f4:07:6a (00:50:56:f4:07:6a), Dst: VMware_8e:c9:4a (00:0c:29:8e:c9:4a)
Internet Protocol Version 4, Src: 142.250.77.196, Dst: 192.168.130.129
Transmission Control Protocol, Src Port: 443, Dst Port: 57896, Seq: 1, Ack: 663, Len: 1412
Transport Layer Security

No.     Time           Source                Destination           Protocol Length Info
     53 70.980860      192.168.130.129       142.250.77.196        TCP      54     57896 → 443 [ACK] Seq=663 Ack=1413 Win=65535 Len=0

Frame 53: 54 bytes on wire (432 bits), 54 bytes captured (432 bits)
Ethernet II, Src: VMware_8e:c9:4a (00:0c:29:8e:c9:4a), Dst: VMware_f4:07:6a (00:50:56:f4:07:6a)
Internet Protocol Version 4, Src: 192.168.130.129, Dst: 142.250.77.196
Transmission Control Protocol, Src Port: 57896, Dst Port: 443, Seq: 663, Ack: 1413, Len: 0

No.     Time           Source                Destination           Protocol Length Info
     54 70.983330      142.250.77.196        192.168.130.129       TLSv1.3  2739   Application Data

Frame 54: 2739 bytes on wire (21912 bits), 2739 bytes captured (21912 bits)
Ethernet II, Src: VMware_f4:07:6a (00:50:56:f4:07:6a), Dst: VMware_8e:c9:4a (00:0c:29:8e:c9:4a)
Internet Protocol Version 4, Src: 142.250.77.196, Dst: 192.168.130.129
Transmission Control Protocol, Src Port: 443, Dst Port: 57896, Seq: 1413, Ack: 663, Len: 2685
[2 Reassembled TCP Segments (3964 bytes): #52(1279), #54(2685)]
Transport Layer Security

No.     Time           Source                Destination           Protocol Length Info
     55 70.983435      192.168.130.129       142.250.77.196        TCP      54     57896 → 443 [ACK] Seq=663 Ack=4098 Win=65535 Len=0

Frame 55: 54 bytes on wire (432 bits), 54 bytes captured (432 bits)
Ethernet II, Src: VMware_8e:c9:4a (00:0c:29:8e:c9:4a), Dst: VMware_f4:07:6a (00:50:56:f4:07:6a)
Internet Protocol Version 4, Src: 192.168.130.129, Dst: 142.250.77.196
Transmission Control Protocol, Src Port: 57896, Dst Port: 443, Seq: 663, Ack: 4098, Len: 0

No.     Time           Source                Destination           Protocol Length Info
     56 71.059490      192.168.130.129       192.168.130.2         DNS      70     Standard query 0x0529 A o.pki.goog

Frame 56: 70 bytes on wire (560 bits), 70 bytes captured (560 bits)
Ethernet II, Src: VMware_8e:c9:4a (00:0c:29:8e:c9:4a), Dst: VMware_f4:07:6a (00:50:56:f4:07:6a)
Internet Protocol Version 4, Src: 192.168.130.129, Dst: 192.168.130.2
User Datagram Protocol, Src Port: 34138, Dst Port: 53
Domain Name System (query)

No.     Time           Source                Destination           Protocol Length Info
     57 71.068375      192.168.130.2         192.168.130.129       DNS      169    Standard query response 0x0529 A o.pki.goog CNAME pki-goog.l.google.com A 142.251.43.163 A 142.250.182.163 A 142.250.67.67 A 172.217.24.67

Frame 57: 169 bytes on wire (1352 bits), 169 bytes captured (1352 bits)
Ethernet II, Src: VMware_f4:07:6a (00:50:56:f4:07:6a), Dst: VMware_8e:c9:4a (00:0c:29:8e:c9:4a)
Internet Protocol Version 4, Src: 192.168.130.2, Dst: 192.168.130.129
User Datagram Protocol, Src Port: 53, Dst Port: 34138
Domain Name System (response)

No.     Time           Source                Destination           Protocol Length Info
     58 71.071223      192.168.130.129       142.251.43.163        TCP      74     56864 → 80 [SYN] Seq=0 Win=64240 Len=0 MSS=1460 SACK_PERM TSval=2243303937 TSecr=0 WS=128

Frame 58: 74 bytes on wire (592 bits), 74 bytes captured (592 bits)
Ethernet II, Src: VMware_8e:c9:4a (00:0c:29:8e:c9:4a), Dst: VMware_f4:07:6a (00:50:56:f4:07:6a)
Internet Protocol Version 4, Src: 192.168.130.129, Dst: 142.251.43.163
Transmission Control Protocol, Src Port: 56864, Dst Port: 80, Seq: 0, Len: 0

No.     Time           Source                Destination           Protocol Length Info
     59 71.082565      142.251.43.163        192.168.130.129       TCP      60     80 → 56864 [SYN, ACK] Seq=0 Ack=1 Win=64240 Len=0 MSS=1460

Frame 59: 60 bytes on wire (480 bits), 60 bytes captured (480 bits)
Ethernet II, Src: VMware_f4:07:6a (00:50:56:f4:07:6a), Dst: VMware_8e:c9:4a (00:0c:29:8e:c9:4a)
Internet Protocol Version 4, Src: 142.251.43.163, Dst: 192.168.130.129
Transmission Control Protocol, Src Port: 80, Dst Port: 56864, Seq: 0, Ack: 1, Len: 0

No.     Time           Source                Destination           Protocol Length Info
     60 71.082625      192.168.130.129       142.251.43.163        TCP      54     56864 → 80 [ACK] Seq=1 Ack=1 Win=64240 Len=0

Frame 60: 54 bytes on wire (432 bits), 54 bytes captured (432 bits)
Ethernet II, Src: VMware_8e:c9:4a (00:0c:29:8e:c9:4a), Dst: VMware_f4:07:6a (00:50:56:f4:07:6a)
Internet Protocol Version 4, Src: 192.168.130.129, Dst: 142.251.43.163
Transmission Control Protocol, Src Port: 56864, Dst Port: 80, Seq: 1, Ack: 1, Len: 0

No.     Time           Source                Destination           Protocol Length Info
     61 71.088424      192.168.130.129       142.251.43.163        OCSP     481    Request

Frame 61: 481 bytes on wire (3848 bits), 481 bytes captured (3848 bits)
Ethernet II, Src: VMware_8e:c9:4a (00:0c:29:8e:c9:4a), Dst: VMware_f4:07:6a (00:50:56:f4:07:6a)
Internet Protocol Version 4, Src: 192.168.130.129, Dst: 142.251.43.163
Transmission Control Protocol, Src Port: 56864, Dst Port: 80, Seq: 1, Ack: 1, Len: 427
Hypertext Transfer Protocol
Online Certificate Status Protocol

No.     Time           Source                Destination           Protocol Length Info
     62 71.089087      142.251.43.163        192.168.130.129       TCP      60     80 → 56864 [ACK] Seq=1 Ack=428 Win=64240 Len=0

Frame 62: 60 bytes on wire (480 bits), 60 bytes captured (480 bits)
Ethernet II, Src: VMware_f4:07:6a (00:50:56:f4:07:6a), Dst: VMware_8e:c9:4a (00:0c:29:8e:c9:4a)
Internet Protocol Version 4, Src: 142.251.43.163, Dst: 192.168.130.129
Transmission Control Protocol, Src Port: 80, Dst Port: 56864, Seq: 1, Ack: 428, Len: 0

No.     Time           Source                Destination           Protocol Length Info
     63 71.170267      142.251.43.163        192.168.130.129       OCSP     1156   Response

Frame 63: 1156 bytes on wire (9248 bits), 1156 bytes captured (9248 bits)
Ethernet II, Src: VMware_f4:07:6a (00:50:56:f4:07:6a), Dst: VMware_8e:c9:4a (00:0c:29:8e:c9:4a)
Internet Protocol Version 4, Src: 142.251.43.163, Dst: 192.168.130.129
Transmission Control Protocol, Src Port: 80, Dst Port: 56864, Seq: 1, Ack: 428, Len: 1102
Hypertext Transfer Protocol
Online Certificate Status Protocol

No.     Time           Source                Destination           Protocol Length Info
     64 71.170354      192.168.130.129       142.251.43.163        TCP      54     56864 → 80 [ACK] Seq=428 Ack=1103 Win=64240 Len=0

Frame 64: 54 bytes on wire (432 bits), 54 bytes captured (432 bits)
Ethernet II, Src: VMware_8e:c9:4a (00:0c:29:8e:c9:4a), Dst: VMware_f4:07:6a (00:50:56:f4:07:6a)
Internet Protocol Version 4, Src: 192.168.130.129, Dst: 142.251.43.163
Transmission Control Protocol, Src Port: 56864, Dst Port: 80, Seq: 428, Ack: 1103, Len: 0

No.     Time           Source                Destination           Protocol Length Info
     65 71.172661      192.168.130.129       142.250.77.196        TLSv1.3  118    Change Cipher Spec, Application Data

Frame 65: 118 bytes on wire (944 bits), 118 bytes captured (944 bits)
Ethernet II, Src: VMware_8e:c9:4a (00:0c:29:8e:c9:4a), Dst: VMware_f4:07:6a (00:50:56:f4:07:6a)
Internet Protocol Version 4, Src: 192.168.130.129, Dst: 142.250.77.196
Transmission Control Protocol, Src Port: 57896, Dst Port: 443, Seq: 663, Ack: 4098, Len: 64
Transport Layer Security

No.     Time           Source                Destination           Protocol Length Info
     66 71.173158      192.168.130.129       142.250.77.196        TLSv1.3  146    Application Data

Frame 66: 146 bytes on wire (1168 bits), 146 bytes captured (1168 bits)
Ethernet II, Src: VMware_8e:c9:4a (00:0c:29:8e:c9:4a), Dst: VMware_f4:07:6a (00:50:56:f4:07:6a)
Internet Protocol Version 4, Src: 192.168.130.129, Dst: 142.250.77.196
Transmission Control Protocol, Src Port: 57896, Dst Port: 443, Seq: 727, Ack: 4098, Len: 92
Transport Layer Security

No.     Time           Source                Destination           Protocol Length Info
     67 71.173544      142.250.77.196        192.168.130.129       TCP      60     443 → 57896 [ACK] Seq=4098 Ack=727 Win=64240 Len=0

Frame 67: 60 bytes on wire (480 bits), 60 bytes captured (480 bits)
Ethernet II, Src: VMware_f4:07:6a (00:50:56:f4:07:6a), Dst: VMware_8e:c9:4a (00:0c:29:8e:c9:4a)
Internet Protocol Version 4, Src: 142.250.77.196, Dst: 192.168.130.129
Transmission Control Protocol, Src Port: 443, Dst Port: 57896, Seq: 4098, Ack: 727, Len: 0

No.     Time           Source                Destination           Protocol Length Info
     68 71.173545      142.250.77.196        192.168.130.129       TCP      60     443 → 57896 [ACK] Seq=4098 Ack=819 Win=64240 Len=0

Frame 68: 60 bytes on wire (480 bits), 60 bytes captured (480 bits)
Ethernet II, Src: VMware_f4:07:6a (00:50:56:f4:07:6a), Dst: VMware_8e:c9:4a (00:0c:29:8e:c9:4a)
Internet Protocol Version 4, Src: 142.250.77.196, Dst: 192.168.130.129
Transmission Control Protocol, Src Port: 443, Dst Port: 57896, Seq: 4098, Ack: 819, Len: 0

No.     Time           Source                Destination           Protocol Length Info
     69 71.200122      142.250.77.196        192.168.130.129       TLSv1.3  699    Application Data, Application Data, Application Data

Frame 69: 699 bytes on wire (5592 bits), 699 bytes captured (5592 bits)
Ethernet II, Src: VMware_f4:07:6a (00:50:56:f4:07:6a), Dst: VMware_8e:c9:4a (00:0c:29:8e:c9:4a)
Internet Protocol Version 4, Src: 142.250.77.196, Dst: 192.168.130.129
Transmission Control Protocol, Src Port: 443, Dst Port: 57896, Seq: 4098, Ack: 819, Len: 645
Transport Layer Security

No.     Time           Source                Destination           Protocol Length Info
     70 71.200212      192.168.130.129       142.250.77.196        TCP      54     57896 → 443 [ACK] Seq=819 Ack=4743 Win=65535 Len=0

Frame 70: 54 bytes on wire (432 bits), 54 bytes captured (432 bits)
Ethernet II, Src: VMware_8e:c9:4a (00:0c:29:8e:c9:4a), Dst: VMware_f4:07:6a (00:50:56:f4:07:6a)
Internet Protocol Version 4, Src: 192.168.130.129, Dst: 142.250.77.196
Transmission Control Protocol, Src Port: 57896, Dst Port: 443, Seq: 819, Ack: 4743, Len: 0

No.     Time           Source                Destination           Protocol Length Info
     71 71.200764      192.168.130.129       142.250.77.196        TLSv1.3  85     Application Data

Frame 71: 85 bytes on wire (680 bits), 85 bytes captured (680 bits)
Ethernet II, Src: VMware_8e:c9:4a (00:0c:29:8e:c9:4a), Dst: VMware_f4:07:6a (00:50:56:f4:07:6a)
Internet Protocol Version 4, Src: 192.168.130.129, Dst: 142.250.77.196
Transmission Control Protocol, Src Port: 57896, Dst Port: 443, Seq: 819, Ack: 4743, Len: 31
Transport Layer Security

No.     Time           Source                Destination           Protocol Length Info
     72 71.201852      142.250.77.196        192.168.130.129       TCP      60     443 → 57896 [ACK] Seq=4743 Ack=850 Win=64240 Len=0

